{
  "id": "rub_site_clips",
  "version": 1,
  "name": "Site clips: what Ormes measures on the footage shown on the website",
  "task": {
    "description": "Factory work, head-mounted camera. Task completion is not evaluated here."
  },
  "checks": {
    "task_completed": { "enabled": false },
    "hands_visible": { "enabled": true, "critical": false, "scope": "manipulation", "require_both": true, "min_ratio": 0.6 },
    "framing": { "enabled": true, "critical": false, "max_off_target_ratio": 0.1, "max_unstable_ratio": 0.3 },
    "technical": { "enabled": true, "critical": true, "max_blur_ratio": 0.1, "max_bad_exposure_ratio": 0.05 },
    "privacy": { "enabled": true, "faces": "reject", "documents": "reject", "screens": "reject" },
    "originality": { "enabled": false }
  }
}
