{
  "id": "rub_eval_v0",
  "version": 2,
  "name": "Eval v0: technical, framing, privacy (review), originality, hands",
  "task": {
    "description": "Factory work, head-mounted camera. Task completion is not evaluated in this rubric."
  },
  "checks": {
    "task_completed": { "enabled": false },
    "hands_visible": { "enabled": true, "critical": true, "scope": "manipulation", "require_both": true, "min_ratio": 0.8 },
    "framing": { "enabled": true, "critical": false, "max_off_target_ratio": 0.1, "max_unstable_ratio": 0.1 },
    "technical": { "enabled": true, "critical": true, "max_blur_ratio": 0.05, "max_bad_exposure_ratio": 0.1 },
    "privacy": { "enabled": true, "faces": "review", "documents": "review", "screens": "review" },
    "originality": { "enabled": true, "similarity_threshold": 0.9, "on_duplicate": "reject" }
  }
}
